{"bundle_id":"g1-loc-003b-minimap-marker-20260830","entries":[{"claims":["report_digest:9528f117200bfcb24d3723a081e83e4889f273322c798fef6fd62cfc14a361ff","status:PASS","sample_count:300","repeat_count:3","detected:194","no_marker:6","rejected:100","fault:0","truth_scope:frame_ingestion_only","marker_accuracy_claim:none"],"evidence_id":"g1-loc-003b-marker-replay-report","kind":"replay","path":"evidence/g1-loc-003b/g1-loc-003b-marker-replay-20260830.json","sha256":"37076a1937fa10ce317c4899a43470dfcce9dd7c155f6a0efa8ef089f0efc4d5","size_bytes":636240,"status":"passed"},{"claims":["semantic_digest:47936cf77e46ebc62fd3d6dae241237307ebb370fd81a197745486812c58f22a","artifact_kind:marker-config"],"evidence_id":"g1-loc-003b-marker-config","kind":"hash","path":"configs/g1-loc-003b-minimap-marker.json","sha256":"50c39babefe3d704a2d98bc10d845f08a07119ca39328db170618c4681088b79","size_bytes":1393,"status":"passed"},{"claims":["extractor_artifact_digest:508b309fce0988a2b0c1e7f4b2ab13a4702a969be5f0175950cb9f779c18a651","artifact_kind:extractor-source"],"evidence_id":"g1-loc-003b-marker-source","kind":"hash","path":"src/maple_automation_core/localization/minimap_marker.py","sha256":"508b309fce0988a2b0c1e7f4b2ab13a4702a969be5f0175950cb9f779c18a651","size_bytes":74961,"status":"passed"},{"claims":["artifact_kind:replay-schema","schema_version:1.0.0"],"evidence_id":"g1-loc-003b-replay-schema","kind":"hash","path":"schemas/player-marker-replay-report.schema.json","sha256":"686a2a7d531e079da66ae8fa99f82a30aa4bbf91fb8e2ee181a1725497733868","size_bytes":10296,"status":"passed"},{"claims":["candidate_packet_digest:4e21973f66fd5c4480c1417d1509a0e21069551d728bf02607319008cbf74f73","manifest_digest:e36863e24ea95295e8e6e9858283ab34706e463b6f675a6e7c856fa51b1e616b","truth_scope:frame_ingestion_only"],"evidence_id":"g1-loc-003b-b2-corpus-manifest","kind":"manifest","path":"evidence/g1-frame-candidate-20260829/corpus/frame-corpus-manifest.json","sha256":"11bcb481e3c683a44ce41e4dcef9ee98ad3172eea8f434c30f1b4d36e0464b91","size_bytes":195259,"status":"passed"},{"claims":["event_tape_index_artifact_digest:244620029379430ac43a4b7a1cc2da03888011937abbf4c62e9b275609d6d8cc"],"evidence_id":"g1-loc-003b-b2-event-tape-index","kind":"asset-index","path":"evidence/g1-frame-candidate-20260829/event-tape-index.json","sha256":"244620029379430ac43a4b7a1cc2da03888011937abbf4c62e9b275609d6d8cc","size_bytes":1083,"status":"passed"},{"claims":["accepted_ledger_digest:5628357d9d1889c76bc9c8c1f938ba331df56ca8f83f0a693453cf347ea3b269"],"evidence_id":"g1-loc-003b-b2-accepted-ledger","kind":"hash","path":"evidence/g1-frame-candidate-20260829/accepted-frame-ledger.jsonl","sha256":"5628357d9d1889c76bc9c8c1f938ba331df56ca8f83f0a693453cf347ea3b269","size_bytes":2820715,"status":"passed"},{"claims":["calibration_artifact_digest:379962db0397326bd021a1a0c361952dcad75ba9e23324d8926aa560ded3dff0"],"evidence_id":"g1-loc-003b-b2-calibration","kind":"hash","path":"evidence/g1-frame-candidate-20260829/calibration.json","sha256":"379962db0397326bd021a1a0c361952dcad75ba9e23324d8926aa560ded3dff0","size_bytes":392,"status":"passed"},{"claims":["zero_input_audit_artifact_digest:284a3371742de5ce185f6ca5197be6a252d70819b7ba1c1ed3bd26cfc2ff8ed9","input_owner:legacy","core_v2_real_input_call_count:0","double_write_event_count:0"],"evidence_id":"g1-loc-003b-b2-zero-input-audit","kind":"hash","path":"evidence/g1-frame-candidate-20260829/zero-input-audit-report.json","sha256":"284a3371742de5ce185f6ca5197be6a252d70819b7ba1c1ed3bd26cfc2ff8ed9","size_bytes":555,"status":"passed"}],"evidence_index_id":"g1-loc-003b-evidence-index-20260830","execution_mode":"offline","generated_at":"2026-08-30T06:19:14Z","input_policy":{"owner":"legacy","real_input_enabled":false},"lifecycle":"replay-valid","release_id":"g1-loc-003b-minimap-marker-20260830","schema_version":"1.0.0","source_commit":"58f20f314733b2c1791665f37fc0fe7c80e009a7","subject_id":"subject-anonymous-player"}
